<?xml version="1.0" encoding="UTF-8" standalone="yes"?>
<?xml-stylesheet href="Uebersicht_Kunden_HTML.xsl" type="text/xsl"?>

<test:Ferienwohnungsvermittlungsagentur
        xmlns:test="http://example.com/Quatsch"
        xmlns:xsi="http://www.w3.org/2001/XMLSchema-instance"
        xsi:schemaLocation="http://example.com/Quatsch /2_Datendefinition/Ferienwohnungsvermittlungsagentur.xsd">

    <Kunden>
        <Kunde ID="1">
            <Name>Karl</Name>
            <Vorname>Napf</Vorname>
            <Geburtsdatum>1960-01-01</Geburtsdatum>
            <Adresse>
                <Land>DE</Land>
                <Ort>Konstanz</Ort>
                <PLZ>78467</PLZ>
                <Straße>Reutestraße 104</Straße>
            </Adresse>
            <Email>knapf@gmx.de</Email>
            <Telefon>07531-123456</Telefon>
            <Bankverbindung>
                <IBAN>DE85692717230007823212</IBAN>
                <Kontonummer>7823212</Kontonummer>
                <BLZ>69271723</BLZ>
                <BIC>KARSDE66XXX</BIC>
            </Bankverbindung>
        </Kunde>
        <Kunde ID="2">
            <Name>Meier</Name>
            <Vorname>Hans</Vorname>
            <Geburtsdatum>1975-01-02</Geburtsdatum>
            <Adresse>
                <Land>DE</Land>
                <Ort>Heidelberg</Ort>
                <PLZ>69115</PLZ>
                <Straße>Hauptstraße 12</Straße>
            </Adresse>
            <Email>meier.hans@t-online.de</Email>
            <Telefon>06221-999888</Telefon>
            <Bankverbindung>
                <IBAN>DE83692717230008929368</IBAN>
                <Kontonummer>7823212</Kontonummer>
                <BLZ>32793968</BLZ>
                <BIC>BARSDE77XXX</BIC>
            </Bankverbindung>
        </Kunde>
        <Kunde ID="3">
            <Name>Huber</Name>
            <Vorname>Franz</Vorname>
            <Geburtsdatum>1980-01-03</Geburtsdatum>
            <Adresse>
                <Land>DE</Land>
                <Ort>Stuttgart</Ort>
                <PLZ>70713</PLZ>
                <Straße>Schlossstraße 54</Straße>
            </Adresse>
            <Email>huber@t-online.de</Email>
            <Telefon>0711-554673</Telefon>
            <Bankverbindung>
                <IBAN>DE85692717230001347291</IBAN>
                <Kontonummer>1347291</Kontonummer>
                <BLZ>69271723</BLZ>
                <BIC>KARSDE66XXX</BIC>
            </Bankverbindung>
        </Kunde>
        <Kunde ID="4">
            <Name>Eber</Name>
            <Vorname>Klaus</Vorname>
            <Geburtsdatum>1985-01-06</Geburtsdatum>
            <Adresse>
                <Land>CH</Land>
                <Ort>Bern</Ort>
                <PLZ>3001</PLZ>
                <Straße>Alpenstraße 11</Straße>
            </Adresse>
            <Email>eber@bluewin.ch</Email>
            <Telefon>+41-171-9864785</Telefon>
            <Bankverbindung>
                <IBAN>CH85692717230008792978</IBAN>
                <Kontonummer>8792978</Kontonummer>
                <BLZ>29788431</BLZ>
                <BIC>MEMECH88XXX</BIC>
            </Bankverbindung>
        </Kunde>
        <Kunde ID="5">
            <Name>Meier</Name>
            <Vorname>Egon</Vorname>
            <Geburtsdatum>1990-01-05</Geburtsdatum>
            <Adresse>
                <Land>CH</Land>
                <Ort>Zürich</Ort>
                <PLZ>8001</PLZ>
                <Straße>Seeweg 23</Straße>
            </Adresse>
            <Email>meier@gmail.com</Email>
            <Telefon>+41-171-9864786</Telefon>
            <Bankverbindung>
                <IBAN>CH85692717230009082780</IBAN>
                <Kontonummer>9082780</Kontonummer>
                <BLZ>87890271</BLZ>
                <BIC>KONSCH12XXX</BIC>
            </Bankverbindung>
        </Kunde>
        <Kunde ID="6">
            <Name>Knopf</Name>
            <Vorname>Jim</Vorname>
            <Geburtsdatum>1995-01-06</Geburtsdatum>
            <Adresse>
                <Land>DE</Land>
                <Ort>Konstanz</Ort>
                <PLZ>78462</PLZ>
                <Straße>Rheingutstraße 14</Straße>
            </Adresse>
            <Email>jim.knopf@gmx.net</Email>
            <Telefon>0171-9876543</Telefon>
            <Bankverbindung>
                <IBAN>DE85692717230007322890</IBAN>
                <Kontonummer>7322890</Kontonummer>
                <BLZ>69271723</BLZ>
                <BIC>KARSDE66XXX</BIC>
            </Bankverbindung>
        </Kunde>
    </Kunden>
    <Ferienwohnungen>
        <Wohnung ID="1">
            <Preis>349</Preis>
            <Größe>200</Größe>
            <ZimmerAnzahl>6</ZimmerAnzahl>
            <Bilder>
                <Bild>
                    <Pfad>1_2.jpg</Pfad>
                    <Titel>Innenansicht</Titel></Bild>
                <Bild>
                    <Pfad>1_1.jpg</Pfad>
                    <Titel>Aussenansicht</Titel>
                </Bild>
            </Bilder>
            <Beschreibung>Finka</Beschreibung>
            <Adresse>
                <Land>TR</Land>
                <Ort>Öludeniz</Ort>
                <PLZ>2349</PLZ>
                <Straße>Highway 5</Straße>
            </Adresse>
            <Zusatzaustattung>
                <Austattung>Schwimmbad</Austattung>
                <Austattung>Sauna</Austattung>
            </Zusatzaustattung>
        </Wohnung>
        <Wohnung ID="2">
            <Preis>120</Preis>
            <Größe>45</Größe>
            <ZimmerAnzahl>2</ZimmerAnzahl>
            <Bilder>
                <Bild>
                    <Pfad>2_1.jpg</Pfad>
                    <Titel>Aussenansicht</Titel>
                </Bild>
                <Bild>
                    <Pfad>2_2.jpg</Pfad>
                    <Titel>Innenansicht</Titel>
                </Bild>
            </Bilder>
            <Beschreibung>Ferienwohnung mit Seeblick</Beschreibung>
            <Adresse>
                <Land>DE</Land>
                <Ort>Konstanz</Ort>
                <PLZ>78461</PLZ>
                <Straße>Markgrafenstraße 33</Straße>
            </Adresse>
        </Wohnung>
        <Wohnung ID="3">
            <Preis>249</Preis>
            <Größe>150</Größe>
            <ZimmerAnzahl>3</ZimmerAnzahl>
            <Beschreibung>im Schnee</Beschreibung>
            <Adresse>
                <Land>CH</Land>
                <Ort>Chur</Ort>
                <PLZ>2234</PLZ>
                <Straße>Zur Piste 189</Straße>
            </Adresse>
            <Zusatzaustattung>
                <Austattung>Sauna</Austattung>
            </Zusatzaustattung>
        </Wohnung>
        <Wohnung ID="4">
            <Preis>249</Preis>
            <Größe>100</Größe>
            <ZimmerAnzahl>4</ZimmerAnzahl>
            <Beschreibung>direkt am Meer</Beschreibung>
            <Adresse>
                <Land>FR</Land>
                <Ort>Bordeaux</Ort>
                <PLZ>8234</PLZ>
                <Straße>rue Monsieur 980</Straße>
            </Adresse>
        </Wohnung>
        <Wohnung ID="5">
            <Preis>289</Preis>
            <Größe>110</Größe>
            <ZimmerAnzahl>3</ZimmerAnzahl>
            <Bilder>
                <Bild>
                    <Pfad>5_1.gif</Pfad>
                    <Titel>Garage</Titel>
                </Bild>
            </Bilder>
            <Beschreibung>direkt am Park</Beschreibung>
            <Adresse>
                <Land>FR</Land>
                <Ort>Disneyland</Ort>
                <PLZ>8787</PLZ>
                <Straße>rue de gaulle 22</Straße>
            </Adresse>
            <Zusatzaustattung>
                <Austattung>Kinderbetreuung</Austattung>
                <Austattung>Schwimmbad</Austattung>
            </Zusatzaustattung>
        </Wohnung>
        <Wohnung ID="6">
            <Preis>549</Preis>
            <Größe>70</Größe>
            <ZimmerAnzahl>2</ZimmerAnzahl>
            <Beschreibung>mit Blick auf Eiffelturm</Beschreibung>
            <Adresse>
                <Land>FR</Land>
                <Ort>Paris</Ort>
                <PLZ>8792</PLZ>
                <Straße>rue de la Maison Blanche 32</Straße>
            </Adresse>
            <Zusatzaustattung>
                <Austattung>Schwimmbad</Austattung>
            </Zusatzaustattung>
        </Wohnung>
        <Wohnung ID="7">
            <Preis>159</Preis>
            <Größe>110</Größe>
            <ZimmerAnzahl>6</ZimmerAnzahl>
            <Beschreibung>Dachterrassewohnung zentral</Beschreibung>
            <Adresse>
                <Land>FR</Land>
                <Ort>Paris</Ort>
                <PLZ>8792</PLZ>
                <Straße>rue liberte 78</Straße>
            </Adresse>
            <Zusatzaustattung>
                <Austattung>Schwimmbad</Austattung>
            </Zusatzaustattung>
        </Wohnung>
        <Wohnung ID="8">
            <Preis>249</Preis>
            <Größe>200</Größe>
            <ZimmerAnzahl>12</ZimmerAnzahl>
            <Bilder>
                <Bild>
                    <Pfad>8.jpg</Pfad>
                    <Titel>Dachterrasse</Titel>
                </Bild>
            </Bilder>
            <Beschreibung>zweigeschoessiges Haus</Beschreibung>
            <Adresse>
                <Land>TR</Land>
                <Ort>Antalya</Ort>
                <PLZ>2321</PLZ>
                <Straße>Strandweg 90</Straße>
            </Adresse>
            <Zusatzaustattung>
                <Austattung>Sat-TV</Austattung>
                <Austattung>Reinigung</Austattung>
                <Austattung>Dachterrasse</Austattung>
            </Zusatzaustattung>
        </Wohnung>
        <Wohnung ID="9">
            <Preis>159</Preis>
            <Größe>111</Größe>
            <ZimmerAnzahl>5</ZimmerAnzahl>
            <Beschreibung>Topvilla am Strand</Beschreibung>
            <Adresse>
                <Land>TR</Land>
                <Ort>Antalya</Ort>
                <PLZ>2321</PLZ>
                <Straße>Strandweg 91</Straße>
            </Adresse>
            <Zusatzaustattung>